<?xml version="1.0" encoding="ISO-8859-1"?>
<rules xmlns:xsi="http://www.w3.org/2001/XMLSchema-instance"
 xsi:noNamespaceSchemaLocation="strategy.xsd">
 <indicator-direction-rule>
  <indicator>
   <name>FIVE_DAY_AVERAGE_DIRECTION</name>
   <operation>RISING</operation>
  </indicator>
  <trade>
   <instrument>BP.L</instrument>
   <type>BUY</type>
   <quantity>1</quantity>
  </trade>
 </indicator-direction-rule>
 <indicator-direction-rule>
  <indicator>
   <name>FIVE_DAY_AVERAGE_DIRECTION</name>
   <operation>FALLING</operation>
  </indicator>
  <trade>
   <instrument>BP.L</instrument>
   <type>SELL</type>
   <quantity>1</quantity>
  </trade>
 </indicator-direction-rule>
 <indicator-direction-rule>
  <indicator>
   <name>THIRTY_DAY_AVERAGE_DIRECTION</name>
   <operation>RISING</operation>
  </indicator>
  <trade>
   <instrument>BP.L</instrument>
   <type>BUY</type>
   <quantity>1</quantity>
  </trade>
 </indicator-direction-rule>
 <indicator-direction-rule>
  <indicator>
   <name>FIVE_DAY_VOLATILITY_DIRECTION</name>
   <operation>RISING</operation>
  </indicator>
  <trade>
   <instrument>BP.L</instrument>
   <type>BUY</type>
   <quantity>5</quantity>
  </trade>
 </indicator-direction-rule>
 <indicator-value-rule>
  <indicator>
   <name>FIVE_DAY_AVERAGE</name>
   <operation>GREATER</operation>
   <value>500</value>
  </indicator>
  <trade>
   <instrument>BP.L</instrument>
   <type>SELLALL</type>
  </trade>
 </indicator-value-rule>
</rules>
